<?xml version="1.0" encoding="UTF-8" standalone="no"?>
<market xmlns:xsi="http://www.w3.org/2001/XMLSchema-instance"
        xsi:noNamespaceSchemaLocation="https://raw.githubusercontent.com/graimundo/new-marketplace/master/package-res/marketplace.xsd">

	<!-- ***************** -->
	<!-- BA Server Plugins -->
	<!-- ***************** -->

	<!--
	<market_entry>
		<id>marketplace</id>
		<type>Platform</type>
		<img>http://www.webdetails.pt/ficheiros/mk.png</img>
		<small_img>http://www.webdetails.pt/ficheiros/mk_plugin.png</small_img>
		<name>Pentaho Marketplace</name>
		<documentation_url>http://wiki.pentaho.com/display/PMOPEN/Pentaho+BI+Server+Marketplace+Plugin</documentation_url>
		<description>Provide Pentaho, Partners, and Community Developers a marketplace for plugins within the BI Server product.</description>
		<author>Pentaho</author>
		<author_url>http://pentaho.com</author_url>
		<author_logo>http://www.pentaho.com/images/2011/logo.png</author_logo>
		<license>MPL 2.0</license>
		<dependencies>CDF, CDA, CDE</dependencies>
		<versions>
			<version>
				<branch>TRUNK</branch>
				<version>TRUNK-SNAPSHOT</version>
				<name>Trunk</name>
				<package_url>http://ci.analytical-labs.com/job/Webdetails-Marketplace/lastSuccessfulBuild/artifact/dist/marketplace-plugin-TRUNK-SNAPSHOT.zip</package_url>
				<description>Trunk Snapshot. Install at your own risk...</description>
				<build_id>4</build_id>
			</version>
		</versions>
		<screenshots>
			<screenshot></screenshot>
		</screenshots>
	</market_entry>
  -->

	<market_entry>
		<id>marketplace</id>
		<type>Platform</type>
		<img>http://pentaho.com/sites/all/themes/pentaho/_media/logo-pentaho.svg</img>
		<small_img>http://www.webdetails.pt/ficheiros/mk_plugin.png</small_img>
		<name>Pentaho Marketplace</name>
		<documentation_url>http://wiki.pentaho.com/display/PMOPEN/Pentaho+BI+Server+Marketplace+Plugin</documentation_url>
		<description>
			Pentaho Marketplace allows users to explore and test the plugins
			that are most relevant to them. This means high quality and useful
			plugins that users can use to get the most out of their business.
		</description>
		<author>Pentaho</author>
		<author_url>http://pentaho.com</author_url>
		<author_logo>http://pentaho.com/sites/all/themes/pentaho/_media/logo-pentaho.svg</author_logo>
		<license>GLPL v2</license>
		<dependencies/>
		<versions>
			<version>
				<branch>TRUNK</branch>
				<version>TRUNK-SNAPSHOT</version>
				<build_id>1</build_id>
				<name>Latest snapshot build</name>
				<package_url>http://ci.pentaho.com/job/marketplace-4.8/lastSuccessfulBuild/artifact/dist/marketplace-plugin-TRUNK-SNAPSHOT.zip</package_url>
				<description>The latest development snapshot
					build.</description>
				<max_parent_version>4.9</max_parent_version>
				<min_parent_version>1.0</min_parent_version>
        <developmentStage>
          <lane>Community</lane>
          <phase>1</phase>
        </developmentStage>
			</version>
			<version>
				<branch>TRUNK</branch>
				<version>TRUNK-SNAPSHOT</version>
				<build_id>49</build_id>
				<name>Latest snapshot build</name>
				<package_url>http://ci.pentaho.com/job/marketplace/lastSuccessfulBuild/artifact/dist/marketplace-plugin-TRUNK-SNAPSHOT.zip</package_url>
				<description>Build for Pentaho 5.0</description>
				<min_parent_version>5.0</min_parent_version>
        <developmentStage>
          <lane>Customer</lane>
          <phase>2</phase>
        </developmentStage>
			</version>
		</versions>
		<screenshots>
			<screenshot>https://raw2.github.com/pentaho/marketplace/master/marketplace-resources/marketplace-01.png</screenshot>
			<screenshot>https://raw2.github.com/pentaho/marketplace/master/marketplace-resources/marketplace-02.png</screenshot>
			<screenshot>https://raw2.github.com/pentaho/marketplace/master/marketplace-resources/marketplace-03.png</screenshot>
			<screenshot>https://raw2.github.com/pentaho/marketplace/master/marketplace-resources/marketplace-04.png</screenshot>
			<screenshot>https://raw2.github.com/pentaho/marketplace/master/marketplace-resources/marketplace-05.png</screenshot>
		</screenshots>

	</market_entry>


	<market_entry>
		<id>pentaho-cdf</id>
		<type>Platform</type>
		<img>http://www.webdetails.pt/ficheiros/cdf.png</img>
		<small_img>http://www.webdetails.pt/ficheiros/cdf_plugin.png</small_img>
		<name>Community Dashboards Framework</name>
		<documentation_url>http://cdf.webdetails.org</documentation_url>
		<description>
			Community Dashboard Framework (CDF) is the engine that allows you to
			create friendly, powerful and fully featured Dashboards on top of
			the Pentaho Business Intelligence server.
		</description>
		<author>WebDetails</author>
		<author_url>http://webdetails.pt</author_url>
		<author_logo>http://www.webdetails.pt/ficheiros/wd_logo.png</author_logo>
		<license>MPL 2.0</license>
		<dependencies/>
		<versions>
			<version>
				<branch>STABLE</branch>
				<version>14.07.29</version>
				<name>Stable</name>
				<package_url>http://www.webdetails.pt/ficheiros/cdf/14.07.29/4.x/pentaho-cdf-14.07.29.zip</package_url>
				<samples_url>http://www.webdetails.pt/ficheiros/cdf/14.07.29/4.x/pentaho-cdf-samples-14.07.29.zip</samples_url>
				<description>Stable Release</description>
				<max_parent_version>4.9</max_parent_version>
				<min_parent_version>1.0</min_parent_version>
				<build_id/>
        <developmentStage>
          <lane>Customer</lane>
          <phase>2</phase>
        </developmentStage>
			</version>
			<version>
				<branch>STABLE</branch>
				<version>14.07.29</version>
				<name>Stable</name>
				<package_url>http://www.webdetails.pt/ficheiros/cdf/14.07.29/5.x/pentaho-cdf-14.07.29.zip</package_url>
				<samples_url>http://www.webdetails.pt/ficheiros/cdf/14.07.29/5.x/pentaho-cdf-samples-14.07.29.zip</samples_url>
				<description>Stable Release</description>
				<min_parent_version>5.0</min_parent_version>
				<max_parent_version>5.1.99</max_parent_version>
				<build_id/>
        <developmentStage>
          <lane>Customer</lane>
          <phase>2</phase>
        </developmentStage>
			</version>

			<version>
		    <branch>TRUNK</branch>
 			<version>TRUNK-SNAPSHOT</version>
    		<name>Trunk</name>
        <package_url>http://ci.pentaho.com/job/pentaho-cdf-pentaho/lastSuccessfulBuild/artifact/cdf-pentaho/dist/pentaho-cdf-TRUNK-SNAPSHOT.zip</package_url>
        <samples_url>http://ci.pentaho.com/job/pentaho-cdf-pentaho/lastSuccessfulBuild/artifact/cdf-pentaho/dist/pentaho-cdf-samples-TRUNK-SNAPSHOT.zip</samples_url>
        <description>Trunk Snapshot. Get the latest, edgy, still work in progress features here...</description>
        <build_id>119</build_id>
        <min_parent_version>1.0</min_parent_version>
        <max_parent_version>4.9</max_parent_version>
        <developmentStage>
          <lane>Community</lane>
          <phase>3</phase>
        </developmentStage>
      </version>
			<version>
        <branch>TRUNK</branch>
        <version>TRUNK-SNAPSHOT</version>
        <name>Trunk</name>
        <package_url>http://ci.pentaho.com/job/pentaho-cdf/lastSuccessfulBuild/artifact/cdf-pentaho5/dist/pentaho-cdf-TRUNK-SNAPSHOT.zip</package_url>
        <samples_url>http://ci.pentaho.com/job/pentaho-cdf/lastSuccessfulBuild/artifact/cdf-pentaho5/dist/pentaho-cdf-samples-TRUNK-SNAPSHOT.zip</samples_url>
        <description>Build for Pentaho 5.0</description>
        <build_id>465</build_id>
        <min_parent_version>5.0</min_parent_version>
        <developmentStage>
          <lane>Community</lane>
          <phase>3</phase>
        </developmentStage>
      </version>
		</versions>
		<screenshots>
			<screenshot>http://www.webdetails.pt/resources/marketplace-screenshots/cdf/cdf-1.png</screenshot>
			<screenshot>http://www.webdetails.pt/resources/marketplace-screenshots/cdf/cdf-2.png</screenshot>
		</screenshots>
	</market_entry>


	<market_entry>
		<id>cda</id>
		<type>Platform</type>
		<img>http://www.webdetails.pt/ficheiros/cda.png</img>
		<small_img>http://www.webdetails.pt/ficheiros/cda_plugin.png</small_img>
		<name>Community Data Access</name>
		<documentation_url>http://cda.webdetails.org</documentation_url>
		<description>
			Community Data Access (CDA) is a Pentaho plugin designed for
			accessing data with great flexibility. Born for overcoming some
			cons of the older implementation, CDA allows you to access any of
			the various Pentaho data sources.
		</description>
		<author>WebDetails</author>
		<author_url>http://webdetails.pt</author_url>
		<author_logo>http://www.webdetails.pt/ficheiros/wd_logo.png</author_logo>
		<dependencies>CDF</dependencies>
		<license>MPL 2.0</license>
		<versions>
			<version>
				<branch>STABLE</branch>
				<version>14.07.29</version>
				<name>Stable</name>
				<package_url>http://www.webdetails.pt/ficheiros/cda/14.07.29/4.x/cda-14.07.29.zip</package_url>
				<samples_url>http://www.webdetails.pt/ficheiros/cda/14.07.29/4.x/cda-samples-14.07.29.zip</samples_url>
				<description>14.07.29 release.</description>
				<build_id/>
				<max_parent_version>4.9</max_parent_version>
				<min_parent_version>1.0</min_parent_version>
			</version>
			<version>
				<branch>STABLE</branch>
				<version>14.07.29</version>
				<name>Stable</name>
				<package_url>http://www.webdetails.pt/ficheiros/cda/14.07.29/5.x/cda-14.07.29.zip</package_url>
				<samples_url>http://www.webdetails.pt/ficheiros/cda/14.07.29/5.x/cda-samples-14.07.29.zip</samples_url>
				<description>14.07.29 release.</description>
				<build_id/>
				<min_parent_version>5.0</min_parent_version>
				<max_parent_version>5.1.99</max_parent_version>				
			</version>

			<version>
        <branch>TRUNK</branch>
		<version>TRUNK-SNAPSHOT</version>
		<name>Trunk</name>
        <package_url>http://ci.pentaho.com/job/pentaho-cda-pentaho/lastSuccessfulBuild/artifact/cda-pentaho/dist/cda-TRUNK-SNAPSHOT.zip</package_url>